{"registry_version":"1.0.0","kind":"CLEMENT_NATIVE_EXTENSION","generated_at":"2026-08-24T14:43:00+02:00","base_registry":"registry/skills_registry.json","skills":[{"category":"security","conflicts":[],"content_path":"native_skills/security/clement.cyber-domain-intelligence.1317d1942c98/SKILL.md","dependencies":[],"description":"Operational workflow for authorized domain intelligence: correlate DNS, RDAP, TLS, HTTP metadata, reputation, and threat-intelligence evidence into a traceable assessment.","estimated_context_cost":1054,"id":"clement.cyber-domain-intelligence.1317d1942c98","keywords":["cyber","domain","dns","rdap","tls","http","reputation","threat-intelligence","osint","evidence"],"name":"cyber-domain-intelligence","schema_version":"1.0.0","sha256":"1317D1942C98D9D567DBA217B6C81B89BFCC0323DF80C11A3AC5AE78A436B438","source":{"canonical_path":"native_skills/security/clement.cyber-domain-intelligence.1317d1942c98/SKILL.md","library":"clement-studio-native","manifest_sha256":null,"replica_count":1,"replicas":["native_skills/security/clement.cyber-domain-intelligence.1317d1942c98/SKILL.md"]},"status":"CANDIDATE","unresolved_conflicts":[],"unresolved_dependencies":[],"validation_notes":["Native operational cyber skill; base certified import registry remains unchanged until explicit certification."],"version":"1.0.0"},{"category":"security","conflicts":[],"content_path":"native_skills/security/clement.cyber-ip-intelligence.ab508c171572/SKILL.md","dependencies":[],"description":"Operational workflow for authorized IP intelligence: correlate reverse DNS, RDAP/ASN, network ownership, exposure, geolocation hints, and threat-intelligence evidence.","estimated_context_cost":985,"id":"clement.cyber-ip-intelligence.ab508c171572","keywords":["cyber","ip","ipv4","ipv6","rdap","asn","reverse-dns","geolocation","shodan","censys","threat-intelligence"],"name":"cyber-ip-intelligence","schema_version":"1.0.0","sha256":"AB508C1715727593577C6218E95AFB2F6E839C9DFACF36474D3B81FD6277ACCD","source":{"canonical_path":"native_skills/security/clement.cyber-ip-intelligence.ab508c171572/SKILL.md","library":"clement-studio-native","manifest_sha256":null,"replica_count":1,"replicas":["native_skills/security/clement.cyber-ip-intelligence.ab508c171572/SKILL.md"]},"status":"CANDIDATE","unresolved_conflicts":[],"unresolved_dependencies":[],"validation_notes":["Native operational cyber skill; base certified import registry remains unchanged until explicit certification."],"version":"1.0.0"},{"category":"security","conflicts":[],"content_path":"native_skills/security/clement.cyber-web-security-audit.b80f1f985695/SKILL.md","dependencies":[],"description":"Safe, evidence-driven audit workflow for web-facing security posture using TLS and HTTP metadata, security headers, redirects, and non-destructive observations.","estimated_context_cost":1001,"id":"clement.cyber-web-security-audit.b80f1f985695","keywords":["cyber","web","security","audit","tls","http","headers","hsts","csp","redirects","hardening"],"name":"cyber-web-security-audit","schema_version":"1.0.0","sha256":"B80F1F9856958455DDFF929280EFABF42EB7B328544AD06776393927205992B1","source":{"canonical_path":"native_skills/security/clement.cyber-web-security-audit.b80f1f985695/SKILL.md","library":"clement-studio-native","manifest_sha256":null,"replica_count":1,"replicas":["native_skills/security/clement.cyber-web-security-audit.b80f1f985695/SKILL.md"]},"status":"CANDIDATE","unresolved_conflicts":[],"unresolved_dependencies":[],"validation_notes":["Native operational cyber skill; base certified import registry remains unchanged until explicit certification."],"version":"1.0.0"},{"category":"security","conflicts":[],"content_path":"native_skills/security/clement.cyber-threat-intelligence.e77b41e3eb93/SKILL.md","dependencies":[],"description":"Operational threat-intelligence correlation workflow for authorized indicators, combining reputation, exposure, infrastructure, provenance, confidence, and time-sensitive evidence.","estimated_context_cost":955,"id":"clement.cyber-threat-intelligence.e77b41e3eb93","keywords":["cyber","threat-intelligence","ioc","reputation","virustotal","shodan","censys","correlation","provenance"],"name":"cyber-threat-intelligence","schema_version":"1.0.0","sha256":"E77B41E3EB93CA41A5078E4105B32806AB5CE312E5A87A63FD2BEEB3B41AEEF5","source":{"canonical_path":"native_skills/security/clement.cyber-threat-intelligence.e77b41e3eb93/SKILL.md","library":"clement-studio-native","manifest_sha256":null,"replica_count":1,"replicas":["native_skills/security/clement.cyber-threat-intelligence.e77b41e3eb93/SKILL.md"]},"status":"CANDIDATE","unresolved_conflicts":[],"unresolved_dependencies":[],"validation_notes":["Native operational cyber skill; base certified import registry remains unchanged until explicit certification."],"version":"1.0.0"},{"category":"security","conflicts":[],"content_path":"native_skills/security/clement.cyber-file-triage.4f6d32a5c10f/SKILL.md","dependencies":[],"description":"Non-executing file triage workflow for authorized files: compute hashes, inspect metadata, identify type/signature inconsistencies, and correlate reputation evidence without running untrusted content.","estimated_context_cost":977,"id":"clement.cyber-file-triage.4f6d32a5c10f","keywords":["cyber","file","triage","hash","metadata","malware","static-analysis","reputation","chain-of-custody"],"name":"cyber-file-triage","schema_version":"1.0.0","sha256":"4F6D32A5C10F0AB286131A60D90E410CF2D6485CA7782185D8626881E762CFB6","source":{"canonical_path":"native_skills/security/clement.cyber-file-triage.4f6d32a5c10f/SKILL.md","library":"clement-studio-native","manifest_sha256":null,"replica_count":1,"replicas":["native_skills/security/clement.cyber-file-triage.4f6d32a5c10f/SKILL.md"]},"status":"CANDIDATE","unresolved_conflicts":[],"unresolved_dependencies":[],"validation_notes":["Native operational cyber skill; base certified import registry remains unchanged until explicit certification."],"version":"1.0.0"},{"category":"security","conflicts":[],"content_path":"native_skills/security/clement.cyber-osint-investigation.13dbb0ca46f3/SKILL.md","dependencies":[],"description":"Passive cyber-OSINT workflow for authorized investigations, emphasizing source provenance, corroboration, temporal context, privacy minimization, and separation of fact from inference.","estimated_context_cost":987,"id":"clement.cyber-osint-investigation.13dbb0ca46f3","keywords":["cyber","osint","investigation","provenance","corroboration","timeline","infrastructure","privacy","evidence"],"name":"cyber-osint-investigation","schema_version":"1.0.0","sha256":"13DBB0CA46F3C49B59BBADB3E8DBE4A813C33DBAC7ACD76C6DE7404B0429E00D","source":{"canonical_path":"native_skills/security/clement.cyber-osint-investigation.13dbb0ca46f3/SKILL.md","library":"clement-studio-native","manifest_sha256":null,"replica_count":1,"replicas":["native_skills/security/clement.cyber-osint-investigation.13dbb0ca46f3/SKILL.md"]},"status":"CANDIDATE","unresolved_conflicts":[],"unresolved_dependencies":[],"validation_notes":["Native operational cyber skill; base certified import registry remains unchanged until explicit certification."],"version":"1.0.0"},{"category":"security","conflicts":[],"content_path":"native_skills/security/clement.cyber-network-diagnostics.33955e85f2f9/SKILL.md","dependencies":[],"description":"Authorized network-diagnostics workflow for troubleshooting connectivity and defensive posture using minimally invasive observations, explicit scope, and evidence-preserving checks.","estimated_context_cost":956,"id":"clement.cyber-network-diagnostics.33955e85f2f9","keywords":["cyber","network","diagnostics","dns","routing","firewall","tcp","tls","connectivity","troubleshooting"],"name":"cyber-network-diagnostics","schema_version":"1.0.0","sha256":"33955E85F2F9B60D1A28FB2810100C395DD18728DBE53239237F89B043314928","source":{"canonical_path":"native_skills/security/clement.cyber-network-diagnostics.33955e85f2f9/SKILL.md","library":"clement-studio-native","manifest_sha256":null,"replica_count":1,"replicas":["native_skills/security/clement.cyber-network-diagnostics.33955e85f2f9/SKILL.md"]},"status":"CANDIDATE","unresolved_conflicts":[],"unresolved_dependencies":[],"validation_notes":["Native operational cyber skill; base certified import registry remains unchanged until explicit certification."],"version":"1.0.0"},{"category":"security","conflicts":[],"content_path":"native_skills/security/clement.cyber-incident-triage.45a31ce83bbe/SKILL.md","dependencies":[],"description":"Operational incident-triage workflow that combines file, domain, IP, web, and threat-intelligence evidence to prioritize containment, investigation, and escalation without destroying evidence.","estimated_context_cost":1021,"id":"clement.cyber-incident-triage.45a31ce83bbe","keywords":["cyber","incident","triage","containment","ioc","timeline","evidence","response","threat-intelligence"],"name":"cyber-incident-triage","schema_version":"1.0.0","sha256":"45A31CE83BBE65260F26E3D1C816347C164933182EEE1B7B88E7DE92FF850E3E","source":{"canonical_path":"native_skills/security/clement.cyber-incident-triage.45a31ce83bbe/SKILL.md","library":"clement-studio-native","manifest_sha256":null,"replica_count":1,"replicas":["native_skills/security/clement.cyber-incident-triage.45a31ce83bbe/SKILL.md"]},"status":"CANDIDATE","unresolved_conflicts":[],"unresolved_dependencies":[],"validation_notes":["Native operational cyber skill; base certified import registry remains unchanged until explicit certification."],"version":"1.0.0"}]}
